{
  "version": "0",
  "id": "f71bbbbb-5b36-40c2-f7dc-804ca6270cd6",
  "detail-type": "AnalysisRunStateChange",
  "source": "orcabus.workflowmanager",
  "account": "123456789012",
  "time": "2024-05-01T09:25:44Z",
  "region": "ap-southeast-2",
  "resources": [],
  "detail": {
    "orcabusId": "anr.76J5N2J83RED7387G9374NGDBB",
    "timestamp": "2025-05-01T09:25:44Z",
    "status": "DRAFT",
    "analysisRunName": "<unique analysis name>",
    "analysis": {
      "orcabusId": "ana.76J5N2J83RED7387G9374NGDBA",
      "name": "<analysis name>, e.g. oncoanalyser-dna",
      "version": "<analysis version>, e.g. 1.0.4"
    },
    "libraries": [
      {
        "libraryId": "L000001",
        "orcabusId": "lib.01J5M2J44HFJ9424G7074NKTGN"
      },
      {
        "libraryId": "L000002",
        "orcabusId": "lib.01J5M2JFE1JPYV62RYQEG99CP5"
      }
    ],
    "readsets": [
      {
        "orcabusId": "<readset id> fqr.76J5N2J83RED7387G9374NGDBE",
		    "rgid??": "",
        "phenotype??": "normal"
      },
      {
        "orcabusId": "<readset id> fqr.76J5N2J83RED7387G9374NGDBF",
        "phenotype??": "tumor"
      }
    ]
  }
}
