{
  "version": "0",
  "id": "f71bbbbb-5b36-40c2-f7dc-804ca6270cd6",
  "detail-type": "AnalysisRunInitiated",
  "source": "<some glue service>",
  "account": "123456789012",
  "time": "2024-05-01T09:25:44Z",
  "region": "ap-southeast-2",
  "resources": [],
  "detail": {
    "timestamp": "2025-05-01T09:25:44Z",
    "analysisRunName": "<unique analysis run name>",
    "analysisRunId": "anr.76J5N2J83RED7387G9374NGRUN",
    "analysis": {
      "orcabusId": "ana.76J5N2J83RED7387G9374NGDBA",
      "name": "<analysis name>, e.g. oncoanalyser-dna",
      "version": "<analysis version>, e.g. 1.0.4"
    },
    "libraries": [
      {
        "libraryId": "L000001",
        "orcabusId": "lib.01J5M2J44HFJ9424G707NORMAL",
        "readsets": [
          {
            "orcabusId": "<readset id> fqr.76J5N2J83RED7387G9374PAIR1",
            "rgid": "<rgid from FastqListRow>"
          }
        ]
      },
      {
        "libraryId": "L000002",
        "orcabusId": "lib.01J5M2JFE1JPYV62RYQEGTUMOR",
        "readsets": [
          {
            "orcabusId": "<readset id> fqr.76J5N2J83RED7387G9374PAIR1",
            "rgid": "<rgid from FastqListRow>"
          },
          {
            "orcabusId": "<readset id> fqr.76J5N2J83RED7387G9374PAIR2",
            "rgid": "<rgid from FastqListRow for topup>"
          }
        ]
      }
    ],
    "storageEnv": "<storage env code>, e.g. production",
    "computeEnv": "<compute env code>, e.g. production"
  }
}
